{
  "$schema": "./schemas/registry.schema.json",
  "style": "base-vega",
  "rsc": true,
  "tsx": true,
  "tailwind": {
    "config": "",
    "css": "src/app/globals.css",
    "baseColor": "taupe",
    "cssVariables": true,
    "prefix": ""
  },
  "iconLibrary": "lucide",
  "rtl": false,
  "aliases": {
    "components": "@/components",
    "utils": "@/lib/utils",
    "ui": "@/components/ui",
    "lib": "@/lib",
    "hooks": "@/hooks"
  },
  "menuColor": "default-translucent",
  "menuAccent": "subtle",
  "registries": {}
}
